<?xml version="1.0" encoding="UTF-8"?>
<!-- edited with XMLSpy v2006 U (http://www.altova.com) by XMLSPY 2006 Professional Ed., Installed for 5 users (ABB Oy) -->
<!-- edited with XMLSPY v2004 rel. 2 U (http://www.xmlspy.com) by Markku Hamarila/RSC (ABB OY Substation Automation) -->
<!--W3C Schema generated by XMLSPY v2004 rel. 2 U (http://www.xmlspy.com)-->
<xs:schema xmlns:xs="http://www.w3.org/2001/XMLSchema" elementFormDefault="qualified">
	<xs:element name="Access" type="xs:string"/>
	<xs:element name="AttributeName" type="xs:string"/>
	<xs:element name="HelpKey" type="xs:string"/>
	<xs:element name="CaptionID" type="xs:string"/>
	<xs:element name="ConfigurationProperties" type="xs:string"/>
	<xs:element name="DataType" type="xs:string"/>
	<xs:element name="DescID" type="xs:string"/>
	<xs:complexType name="EnumType">
		<xs:attribute name="textID" type="xs:string" use="required"/>
		<xs:attribute name="value" type="xs:string" use="required"/>
	</xs:complexType>
	<xs:complexType name="ExportType" mixed="true">
		<xs:choice minOccurs="0" maxOccurs="unbounded">
			<xs:element ref="ConfigurationProperties" minOccurs="0"/>
			<xs:element name="List" type="ListType" maxOccurs="unbounded"/>
		</xs:choice>
		<xs:attribute name="name" type="xs:string" use="required"/>
		<xs:attribute name="exportType" type="xs:string" use="optional"/>
	</xs:complexType>
	<xs:complexType name="ListType">
		<xs:attribute name="value" type="xs:string" use="required"/>
		<xs:attribute name="properties" type="xs:string" use="required"/>
	</xs:complexType>
	<xs:element name="Max" type="xs:integer"/>
	<xs:element name="Min" type="xs:integer"/>
	<xs:element name="ObjectTypes">
		<xs:complexType>
			<xs:sequence>
				<xs:element name="ObjectType" type="tObjectType" maxOccurs="unbounded"/>
			</xs:sequence>
		</xs:complexType>
	</xs:element>
	<xs:element name="ObjectType" type="tObjectType"/>
	<xs:complexType name="tObjectType">
		<xs:sequence>
			<xs:element name="Parameters" type="ParametersType" maxOccurs="unbounded"/>
			<xs:element name="Properties" type="PropertiesType" minOccurs="0"/>
		</xs:sequence>
	</xs:complexType>
	<xs:complexType name="ParameterType" mixed="true">
		<xs:choice minOccurs="0" maxOccurs="unbounded">
			<xs:element name="List" type="ListType" maxOccurs="unbounded"/>
			<xs:element name="Structure" type="StructureType" maxOccurs="unbounded"/>
		</xs:choice>
		<xs:attribute name="name" type="xs:string" use="required"/>
	</xs:complexType>
	<xs:complexType name="ParametersType">
		<xs:choice>
			<xs:element name="Parameter" type="ParameterType" maxOccurs="unbounded"/>
			<xs:element name="Export" type="ExportType" maxOccurs="unbounded"/>
		</xs:choice>
		<xs:attribute name="type" type="xs:string" use="required"/>
	</xs:complexType>
	<xs:complexType name="PrivateType">
		<xs:simpleContent>
			<xs:extension base="xs:string">
				<xs:attribute name="name" type="xs:string" use="required"/>
			</xs:extension>
		</xs:simpleContent>
	</xs:complexType>
	<xs:complexType name="PropertiesType">
		<xs:sequence>
			<xs:element name="Property" type="PropertyType" maxOccurs="unbounded"/>
		</xs:sequence>
		<xs:attribute name="type" type="xs:string" use="required"/>
	</xs:complexType>
	<xs:complexType name="PropertyType">
		<xs:sequence>
			<xs:element ref="Value"/>
			<xs:element ref="DescID"/>
			<xs:element ref="CaptionID"/>
			<xs:element name="Values" type="ValuesType"/>
			<xs:element ref="DataType"/>
			<xs:element ref="HelpKey"/>
			<xs:element ref="Access"/>
			<xs:element ref="AttributeName" minOccurs="0"/>
			<xs:element name="Private" type="PrivateType" minOccurs="0" maxOccurs="unbounded"/>
		</xs:sequence>
		<xs:attribute name="name" type="xs:string"/>
		<xs:attribute name="category" type="xs:string" use="required"/>
	</xs:complexType>
	<xs:element name="Value" type="xs:string"/>
	<xs:complexType name="ValuesType">
		<xs:sequence>
			<xs:element name="Enum" type="EnumType" minOccurs="0" maxOccurs="unbounded"/>
			<xs:element ref="Min" minOccurs="0"/>
			<xs:element ref="Max" minOccurs="0"/>
			<xs:element name="ListObjects" type="ListObjectType" minOccurs="0"/>
		</xs:sequence>
		<xs:attribute name="type">
			<xs:simpleType>
				<xs:restriction base="xs:NMTOKEN">
					<xs:enumeration value="numerical"/>
					<xs:enumeration value="singleChoice"/>
					<xs:enumeration value="singleChoiceDynamic"/>
					<xs:enumeration value="singleChoiceEditable"/>
					<xs:enumeration value="multiChoice"/>
					<xs:enumeration value="string"/>
					<xs:enumeration value="password"/>
					<xs:enumeration value="boolean"/>
					<xs:enumeration value="SoftPLCOPCItemPath"/>					
					<xs:enumeration value="DocumentLibraryReference"/>		
					<xs:enumeration value="IPOrHostname" />
					<xs:enumeration value="IPOrHostnameWithPort" />								
				</xs:restriction>
			</xs:simpleType>
		</xs:attribute>
	</xs:complexType>
	<xs:complexType name="AndConditionsType">
		<xs:sequence>
			<xs:element name="Condition" type="ConditionType" minOccurs="0" maxOccurs="unbounded"/>
			<xs:element name="OrConditions" type="OrConditionsType" minOccurs="0"/>
			<xs:element name="AndConditions" type="AndConditionsType" minOccurs="0"/>
		</xs:sequence>
	</xs:complexType>
	<xs:complexType name="ConditionType" mixed="true">
		<xs:choice minOccurs="0" maxOccurs="unbounded">
			<xs:element ref="Name"/>
			<xs:element ref="Values"/>
		</xs:choice>
		<xs:attribute name="type" use="required">
			<xs:simpleType>
				<xs:restriction base="xs:NMTOKEN">
					<xs:enumeration value="DataStructureObjectType"/>
					<xs:enumeration value="PCMObjectType"/>
					<xs:enumeration value="PropertyValue"/>
				</xs:restriction>
			</xs:simpleType>
		</xs:attribute>
	</xs:complexType>
	<xs:element name="Name" type="xs:string"/>
	<xs:complexType name="OrConditionsType">
		<xs:sequence>
			<xs:element name="Condition" type="ConditionType" minOccurs="0" maxOccurs="unbounded"/>
			<xs:element name="AndConditions" type="AndConditionsType" minOccurs="0"/>
			<xs:element name="OrConditions" type="OrConditionsType" minOccurs="0"/>
		</xs:sequence>
	</xs:complexType>
	<xs:complexType name="StructureType">
		<xs:choice>
			<xs:element name="Condition" type="ConditionType"/>
			<xs:element name="OrConditions" type="OrConditionsType"/>
			<xs:element name="AndConditions" type="AndConditionsType"/>
			<xs:element name="ChildObject" type="ChildObjectType" minOccurs="0" maxOccurs="unbounded"/>
		</xs:choice>
		<xs:attribute name="name" use="required">
			<xs:simpleType>
				<xs:restriction base="xs:NMTOKEN">
					<xs:enumeration value="COMMUNICATION"/>
					<xs:enumeration value="FUNCTIONAL"/>
					<xs:enumeration value="PCMSTRUCTURE"/>
				</xs:restriction>
			</xs:simpleType>
		</xs:attribute>
	</xs:complexType>
	<xs:element name="Values" type="xs:string"/>
	<xs:complexType name="ChildObjectType">
		<xs:sequence>
			<xs:element name="ChildObject" type="ChildObjectType" minOccurs="0" maxOccurs="unbounded"/>
			<xs:element name="SetPropertyValue" type="SetPropertyValueType" minOccurs="0" maxOccurs="unbounded"/>
		</xs:sequence>
		<xs:attribute name="type" type="xs:string" use="required"/>
		<xs:attribute name="name" type="xs:string" use="required"/>
	</xs:complexType>
	<xs:complexType name="SetPropertyValueType">
		<xs:attribute name="value" type="xs:string" use="required"/>
		<xs:attribute name="name" type="xs:string" use="required"/>
	</xs:complexType>
	<xs:complexType name="ListObjectType">
		<xs:attribute name="findMethod" use="required">
			<xs:simpleType>
				<xs:restriction base="xs:NMTOKEN">
					<xs:enumeration value="ancestorDirectChild"/>
					<xs:enumeration value="ancestorSecondChild"/>
					<xs:enumeration value="ancestorPropertyValue"/>
					<xs:enumeration value="ancestorPropertyValueWithDefaults"/>
				</xs:restriction>
			</xs:simpleType>
		</xs:attribute>
		<xs:attribute name="ancestorDsot" use="required">
			<xs:simpleType>
				<xs:restriction base="xs:NMTOKEN">
					<xs:enumeration value="OPCServer"/>
					<xs:enumeration value="OPCClient"/>
					<xs:enumeration value="LN"/>
					<xs:enumeration value="GATEWAY"/>
				</xs:restriction>
			</xs:simpleType>
		</xs:attribute>
		<xs:attribute name="childObjectType" type="xs:string"/>
		<xs:attribute name="firstchildObjectType" type="xs:string"/>
		<xs:attribute name="secondchildObjectType" type="xs:string"/>
		<xs:attribute name="filterDsot" type="xs:string"/>
		<xs:attribute name="filterObjectType" type="xs:string"/>
		<xs:attribute name="propertyName" type="xs:string"/>
		<xs:attribute name="expectedDefaults" type="xs:string"/>
		<xs:attribute name="separators" type="xs:string"/>
		<xs:attribute name="selectorIndexes" type="xs:string"/>
		<xs:attribute name="idIndex" type="xs:string"/>
	</xs:complexType>
</xs:schema>
