<?xml version="1.0" encoding="UTF-8"?>
<!-- edited with XMLSPY v2004 rel. 2 U (http://www.xmlspy.com) by Markku Hamarila/RSC (ABB OY Substation Automation) -->
<ObjectTypes>
<ObjectType xmlns:xsi="http://www.w3.org/2001/XMLSchema-instance" xsi:noNamespaceSchemaLocation="ObjectType.xsd">
	<Parameters type="InterfaceDefinition">
		<Parameter name="ObjectType">SimpleEventProcess 4.0</Parameter>
		<Parameter name="Caption">objectTypeCaption</Parameter>
		<Parameter name="Description">objectTypeDesc</Parameter>
		<Parameter name="Group">Event Classes</Parameter>
		<Parameter name="Type">EVENT</Parameter>
		<Parameter name="IconFileName">ae.ico</Parameter>
		<Parameter name="Tools"/>
		<Parameter name="DataServers"/>
		<Parameter name="Verbs"/>
		<Parameter name="Visible">True</Parameter>
		<Parameter name="CanInherit">False</Parameter>
		<Parameter name="ParentControlConditions">
			<Structure name="COMMUNICATION">
				<Condition type="PCMObjectType">SimpleEventGroup</Condition>
			</Structure>
		</Parameter>
	</Parameters>
	<Parameters type="SCLExport">
		<Export name="CDATA">BaseType, VarType</Export>
	</Parameters>
	<Properties type="PropertyDefinitions">
		<Property name="OPCObjectType" category="[010] Basic">
			<Value>Event Category</Value>
			<DescID>OPCObjectTypeDesc</DescID>
			<CaptionID>OPCObjectType</CaptionID>
			<Values type="string">
      </Values>
			<DataType>System.String</DataType>
			<HelpKey/>
			<Access>HHR</Access>
			<AttributeName>OPCObjectType</AttributeName>
		</Property>
		<Property name="BaseType" category="Basic">
			<Value>SimpleEventProcess</Value>
			<DescID>Base Type of Event Condition</DescID>
			<CaptionID>Base Type</CaptionID>
			<Values type="singleChoice">
				<Enum textID="Condition Process" value="ConditionProcess"/>
				<Enum textID="Simple Event Process" value="SimpleEventProcess"/>
			</Values>
			<DataType>System.String</DataType>
			<HelpKey/>
			<Access>RRR</Access>
			<AttributeName/>
		</Property>
		<Property name="VarType" category="Basic">
			<Value>3</Value>
			<DescID>Event Class Type that can be assigned with this event category</DescID>
			<CaptionID>Event Class Type</CaptionID>
			<Values type="singleChoice">
				<Enum textID="Discrete" value="3"/>
				<Enum textID="Level" value="4"/>
			</Values>
			<DataType>System.Int32</DataType>
			<HelpKey/>
			<Access>HWW</Access>
			<AttributeName/>
		</Property>
	</Properties>
</ObjectType>
<ObjectType xmlns:xsi="http://www.w3.org/2001/XMLSchema-instance" xsi:noNamespaceSchemaLocation="ObjectType.xsd">
	<Parameters type="InterfaceDefinition">
		<Parameter name="ObjectType">SimpleEventProcess</Parameter>
		<Parameter name="Caption">objectTypeCaption</Parameter>
		<Parameter name="Description">objectTypeDesc</Parameter>
		<Parameter name="Group">Event Classes</Parameter>
		<Parameter name="Type">EVENT</Parameter>
		<Parameter name="IconFileName">ae.ico</Parameter>
		<Parameter name="Tools"/>
		<Parameter name="DataServers"/>
		<Parameter name="Verbs"/>
		<Parameter name="Visible">False</Parameter>
		<Parameter name="CanInherit">False</Parameter>
		<Parameter name="ParentControlConditions">
			<Structure name="COMMUNICATION">
				<Condition type="PCMObjectType">SimpleEventGroup</Condition>
			</Structure>
		</Parameter>
	</Parameters>
	<Parameters type="SCLExport">
		<Export name="CDATA">BaseType, VarType</Export>
	</Parameters>
	<Properties type="PropertyDefinitions">
		<Property name="OPCObjectType" category="[010] Basic">
			<Value>Event Category</Value>
			<DescID>OPCObjectTypeDesc</DescID>
			<CaptionID>OPCObjectType</CaptionID>
			<Values type="string">
      </Values>
			<DataType>System.String</DataType>
			<HelpKey/>
			<Access>HHR</Access>
			<AttributeName>OPCObjectType</AttributeName>
		</Property>
		<Property name="BaseType" category="Basic">
			<Value>SimpleEventProcess</Value>
			<DescID>Base Type of Event Condition</DescID>
			<CaptionID>Base Type</CaptionID>
			<Values type="singleChoice">
				<Enum textID="Condition Process" value="ConditionProcess"/>
				<Enum textID="Simple Event Process" value="SimpleEventProcess"/>
			</Values>
			<DataType>System.String</DataType>
			<HelpKey/>
			<Access>RRR</Access>
			<AttributeName/>
		</Property>
		<Property name="VarType" category="Basic">
			<Value>3</Value>
			<DescID>Event Class Type that can be assigned with this event category</DescID>
			<CaptionID>Event Class Type</CaptionID>
			<Values type="singleChoice">
				<Enum textID="Discrete" value="3"/>
				<Enum textID="Level" value="4"/>
			</Values>
			<DataType>System.Int32</DataType>
			<HelpKey/>
			<Access>HHW</Access>
			<AttributeName/>
		</Property>
	</Properties>
</ObjectType>
</ObjectTypes>